No.     Time           Source                Destination           Protocol Length Info
     81 45.278292000   172.16.45.1           172.16.45.176         HTTP/XML 279    PROPFIND /.well-known/caldav HTTP/1.1 

Frame 81: 279 bytes on wire (2232 bits), 279 bytes captured (2232 bits) on interface 0
Ethernet II, Src: Vmware_c0:00:08 (00:50:56:c0:00:08), Dst: Vmware_26:c6:dc (00:0c:29:26:c6:dc)
Internet Protocol Version 4, Src: 172.16.45.1 (172.16.45.1), Dst: 172.16.45.176 (172.16.45.176)
Transmission Control Protocol, Src Port: 58299 (58299), Dst Port: pcsync-https (8443), Seq: 948, Ack: 944, Len: 213
Secure Sockets Layer
[3 Reassembled SSL segments (534 bytes): #79(353), #80(1), #81(180)]
Hypertext Transfer Protocol
    PROPFIND /.well-known/caldav HTTP/1.1\r\n
        [Expert Info (Chat/Sequence): PROPFIND /.well-known/caldav HTTP/1.1\r\n]
        Request Method: PROPFIND
        Request URI: /.well-known/caldav
        Request Version: HTTP/1.1
    Host: mav.willow.vmw:8443\r\n
    Content-Type: text/xml\r\n
    Depth: 0\r\n
    Brief: t\r\n
    Accept: */*\r\n
    Connection: keep-alive\r\n
    Prefer: return-minimal\r\n
    User-Agent: Mac_OS_X/10.9 (13A603) com.apple.preferences.internetaccounts.remoteservice/12.0-Calendar\r\n
    Content-Length: 181\r\n
    Accept-Language: en-us\r\n
    Accept-Encoding: gzip, deflate\r\n
    \r\n
    [Full request URI: http://mav.willow.vmw:8443/.well-known/caldav]
    [HTTP request 1/1]
    [Response in frame: 93]
eXtensible Markup Language
    <?xml
        version="1.0"
        encoding="UTF-8"
        ?>
    <A:propfind
        xmlns:A="DAV:">
        <A:prop>
            <A:current-user-principal/>
            <A:principal-URL/>
            <A:resourcetype/>
            </A:prop>
        </A:propfind>

No.     Time           Source                Destination           Protocol Length Info
     93 45.283398000   172.16.45.176         172.16.45.1           SSLv3    667    HTTP/1.1 301 Moved Permanently  (text/html), Alert (Level: Warning, Description: Close Notify)

Frame 93: 667 bytes on wire (5336 bits), 667 bytes captured (5336 bits) on interface 0
Ethernet II, Src: Vmware_26:c6:dc (00:0c:29:26:c6:dc), Dst: Vmware_c0:00:08 (00:50:56:c0:00:08)
Internet Protocol Version 4, Src: 172.16.45.176 (172.16.45.176), Dst: 172.16.45.1 (172.16.45.1)
Transmission Control Protocol, Src Port: pcsync-https (8443), Dst Port: 58299 (58299), Seq: 944, Ack: 1161, Len: 601
Secure Sockets Layer
[2 Reassembled SSL segments (425 bytes): #93(274), #93(151)]
Hypertext Transfer Protocol
    HTTP/1.1 301 Moved Permanently\r\n
        [Expert Info (Chat/Sequence): HTTP/1.1 301 Moved Permanently\r\n]
        Request Version: HTTP/1.1
        Status Code: 301
        Response Phrase: Moved Permanently
    Content-Length: 151\r\n
    Date: Thu, 21 Nov 2013 12:28:09 GMT\r\n
    Server: Twisted/12.2.0 TwistedWeb/9.0.0\r\n
    Content-Type: text/html;charset=utf-8\r\n
    Strict-Transport-Security: max-age=604800\r\n
    Location: https://mav.willow.vmw:8443/\r\n
    Connection: close\r\n
    \r\n
    [HTTP response 1/1]
    [Time since request: 0.005106000 seconds]
    [Request in frame: 81]
Line-based text data: text/html
    <html><head><title>Moved Permanently</title></head><body><h1>Moved Permanently</h1><p>Document moved to https://mav.willow.vmw:8443/.</p></body></html>

No.     Time           Source                Destination           Protocol Length Info
    114 45.289495000   172.16.45.1           172.16.45.176         HTTP/XML 279    PROPFIND / HTTP/1.1 

Frame 114: 279 bytes on wire (2232 bits), 279 bytes captured (2232 bits) on interface 0
Ethernet II, Src: Vmware_c0:00:08 (00:50:56:c0:00:08), Dst: Vmware_26:c6:dc (00:0c:29:26:c6:dc)
Internet Protocol Version 4, Src: 172.16.45.1 (172.16.45.1), Dst: 172.16.45.176 (172.16.45.176)
Transmission Control Protocol, Src Port: 58300 (58300), Dst Port: pcsync-https (8443), Seq: 699, Ack: 162, Len: 213
Secure Sockets Layer
[3 Reassembled SSL segments (516 bytes): #112(335), #113(1), #114(180)]
Hypertext Transfer Protocol
    PROPFIND / HTTP/1.1\r\n
        [Expert Info (Chat/Sequence): PROPFIND / HTTP/1.1\r\n]
        Request Method: PROPFIND
        Request URI: /
        Request Version: HTTP/1.1
    Host: mav.willow.vmw:8443\r\n
    Content-Type: text/xml\r\n
    Depth: 0\r\n
    Brief: t\r\n
    Accept: */*\r\n
    Connection: keep-alive\r\n
    Prefer: return-minimal\r\n
    User-Agent: Mac_OS_X/10.9 (13A603) com.apple.preferences.internetaccounts.remoteservice/12.0-Calendar\r\n
    Content-Length: 181\r\n
    Accept-Language: en-us\r\n
    Accept-Encoding: gzip, deflate\r\n
    \r\n
    [Full request URI: http://mav.willow.vmw:8443/]
    [HTTP request 1/1]
    [Response in frame: 120]
eXtensible Markup Language
    <?xml
        version="1.0"
        encoding="UTF-8"
        ?>
    <A:propfind
        xmlns:A="DAV:">
        <A:prop>
            <A:current-user-principal/>
            <A:principal-URL/>
            <A:resourcetype/>
            </A:prop>
        </A:propfind>

No.     Time           Source                Destination           Protocol Length Info
    120 45.295368000   172.16.45.176         172.16.45.1           HTTP     1334   HTTP/1.1 401 Unauthorized  (text/html)

Frame 120: 1334 bytes on wire (10672 bits), 1334 bytes captured (10672 bits) on interface 0
Ethernet II, Src: Vmware_26:c6:dc (00:0c:29:26:c6:dc), Dst: Vmware_c0:00:08 (00:50:56:c0:00:08)
Internet Protocol Version 4, Src: 172.16.45.176 (172.16.45.176), Dst: 172.16.45.1 (172.16.45.1)
Transmission Control Protocol, Src Port: pcsync-https (8443), Dst Port: 58300 (58300), Seq: 162, Ack: 912, Len: 1268
Secure Sockets Layer
[2 Reassembled SSL segments (1125 bytes): #120(984), #120(141)]
Hypertext Transfer Protocol
    HTTP/1.1 401 Unauthorized\r\n
        [Expert Info (Chat/Sequence): HTTP/1.1 401 Unauthorized\r\n]
        Request Version: HTTP/1.1
        Status Code: 401
        Response Phrase: Unauthorized
    [truncated] DAV: 1, access-control, calendar-access, calendar-schedule, calendar-auto-schedule, calendar-availability, inbox-availability, calendar-proxy, calendarserver-private-events, calendarserver-private-comments, calendarserver-shari
    Content-Length: 141\r\n
    Date: Thu, 21 Nov 2013 12:28:09 GMT\r\n
    Server: Twisted/12.2.0 TwistedWeb/9.0.0\r\n
    Content-Type: text/html;charset=utf-8\r\n
    Strict-Transport-Security: max-age=604800\r\n
    WWW-Authenticate: digest nonce="d0fb5a667551b0eb63d739db", algorithm="md5", opaque="5beef27a775f326f454274eee58bf571-ZDBmYjVhNjY3NTUxYjBlYjYzZDczOWRiLDE3Mi4xNi40NS4xLDEzODUwMzY4ODk=", realm="mav.willow.vmw"\r\n
    WWW-Authenticate: basic realm="mav.willow.vmw"\r\n
    Connection: close\r\n
    \r\n
    [HTTP response 1/1]
    [Time since request: 0.005873000 seconds]
    [Request in frame: 114]
Line-based text data: text/html
    <html><head><title>Unauthorized</title></head><body><h1>Unauthorized</h1><p>You are not authorized to access this resource.</p></body></html>

No.     Time           Source                Destination           Protocol Length Info
    151 45.317010000   172.16.45.1           172.16.45.176         HTTP/XML 279    PROPFIND / HTTP/1.1 

Frame 151: 279 bytes on wire (2232 bits), 279 bytes captured (2232 bits) on interface 0
Ethernet II, Src: Vmware_c0:00:08 (00:50:56:c0:00:08), Dst: Vmware_26:c6:dc (00:0c:29:26:c6:dc)
Internet Protocol Version 4, Src: 172.16.45.1 (172.16.45.1), Dst: 172.16.45.176 (172.16.45.176)
Transmission Control Protocol, Src Port: 58301 (58301), Dst Port: pcsync-https (8443), Seq: 1236, Ack: 944, Len: 213
Secure Sockets Layer
[3 Reassembled SSL segments (791 bytes): #149(610), #150(1), #151(180)]
Hypertext Transfer Protocol
    PROPFIND / HTTP/1.1\r\n
        [Expert Info (Chat/Sequence): PROPFIND / HTTP/1.1\r\n]
        Request Method: PROPFIND
        Request URI: /
        Request Version: HTTP/1.1
    Host: mav.willow.vmw:8443\r\n
    Accept: */*\r\n
    Brief: t\r\n
    [truncated] Authorization: Digest username="tom", realm="mav.willow.vmw", nonce="d0fb5a667551b0eb63d739db", uri="/", response="1306cd1f9b4859ae3dc92c7dbbd57f70", opaque="5beef27a775f326f454274eee58bf571-ZDBmYjVhNjY3NTUxYjBlYjYzZDczOWRiLDE3
    Accept-Language: en-us\r\n
    Accept-Encoding: gzip, deflate\r\n
    Content-Type: text/xml\r\n
    Content-Length: 181\r\n
    Depth: 0\r\n
    Connection: keep-alive\r\n
    User-Agent: Mac_OS_X/10.9 (13A603) com.apple.preferences.internetaccounts.remoteservice/12.0-Calendar\r\n
    Prefer: return-minimal\r\n
    \r\n
    [Full request URI: http://mav.willow.vmw:8443/]
    [HTTP request 1/1]
    [Response in frame: 158]
eXtensible Markup Language
    <?xml
        version="1.0"
        encoding="UTF-8"
        ?>
    <A:propfind
        xmlns:A="DAV:">
        <A:prop>
            <A:current-user-principal/>
            <A:principal-URL/>
            <A:resourcetype/>
            </A:prop>
        </A:propfind>

No.     Time           Source                Destination           Protocol Length Info
    158 45.343149000   172.16.45.176         172.16.45.1           SSLv3    177    HTTP/1.1 207 Multi-Status , Alert (Level: Warning, Description: Close Notify)

Frame 158: 177 bytes on wire (1416 bits), 177 bytes captured (1416 bits) on interface 0
Ethernet II, Src: Vmware_26:c6:dc (00:0c:29:26:c6:dc), Dst: Vmware_c0:00:08 (00:50:56:c0:00:08)
Internet Protocol Version 4, Src: 172.16.45.176 (172.16.45.176), Dst: 172.16.45.1 (172.16.45.1)
Transmission Control Protocol, Src Port: pcsync-https (8443), Dst Port: 58301 (58301), Seq: 2392, Ack: 1449, Len: 111
Secure Sockets Layer
[5 Reassembled SSL segments (1147 bytes): #157(862), #157(15), #157(252), #157(13), #158(5)]
Hypertext Transfer Protocol
    HTTP/1.1 207 Multi-Status\r\n
        [Expert Info (Chat/Sequence): HTTP/1.1 207 Multi-Status\r\n]
        Request Version: HTTP/1.1
        Status Code: 207
        Response Phrase: Multi-Status
    Content-Encoding: gzip\r\n
    Accept-Ranges: bytes\r\n
    Strict-Transport-Security: max-age=604800\r\n
    Server: Twisted/12.2.0 TwistedWeb/9.0.0\r\n
    Vary: accept-encoding\r\n
    [truncated] DAV: 1, access-control, calendar-access, calendar-schedule, calendar-auto-schedule, calendar-availability, inbox-availability, calendar-proxy, calendarserver-private-events, calendarserver-private-comments, calendarserver-shari
    ETag: "806A0-66-528CE632"\r\n
    Last-Modified: Wed, 20 Nov 2013 16:41:22 GMT\r\n
    Date: Thu, 21 Nov 2013 12:28:10 GMT\r\n
    Content-Type: text/xml\r\n
    Transfer-Encoding: chunked\r\n
    Connection: close\r\n
    \r\n
    [HTTP response 1/1]
    [Time since request: 0.026139000 seconds]
    [Request in frame: 151]
    HTTP chunked response
    Content-encoded entity body (gzip): 264 bytes -> 458 bytes
eXtensible Markup Language
    <?xml
        version='1.0'
        encoding='UTF-8'
        ?>
    <multistatus
        xmlns='DAV:'>
        <response>
            <href>
                /
                </href>
            <propstat>
                <prop>
                    <current-user-principal>
                        <href>
                            /principals/__uids__/A211480B-0708-4022-A2BC-90D8B3506DFC/
                            </href>
                        </current-user-principal>
                    <resourcetype>
                        <collection/>
                        </resourcetype>
                    </prop>
                <status>
                    HTTP/1.1 200 OK
                    </status>
                </propstat>
            </response>
        </multistatus>

No.     Time           Source                Destination           Protocol Length Info
    188 45.374977000   172.16.45.1           172.16.45.176         HTTP     759    OPTIONS /principals/__uids__/A211480B-0708-4022-A2BC-90D8B3506DFC/ HTTP/1.1 

Frame 188: 759 bytes on wire (6072 bits), 759 bytes captured (6072 bits) on interface 0
Ethernet II, Src: Vmware_c0:00:08 (00:50:56:c0:00:08), Dst: Vmware_26:c6:dc (00:0c:29:26:c6:dc)
Internet Protocol Version 4, Src: 172.16.45.1 (172.16.45.1), Dst: 172.16.45.176 (172.16.45.176)
Transmission Control Protocol, Src Port: 58303 (58303), Dst Port: pcsync-https (8443), Seq: 289, Ack: 162, Len: 693
Secure Sockets Layer
Hypertext Transfer Protocol
    OPTIONS /principals/__uids__/A211480B-0708-4022-A2BC-90D8B3506DFC/ HTTP/1.1\r\n
        [Expert Info (Chat/Sequence): OPTIONS /principals/__uids__/A211480B-0708-4022-A2BC-90D8B3506DFC/ HTTP/1.1\r\n]
        Request Method: OPTIONS
        Request URI: /principals/__uids__/A211480B-0708-4022-A2BC-90D8B3506DFC/
        Request Version: HTTP/1.1
    Host: mav.willow.vmw:8443\r\n
    Content-Length: 0\r\n
    Connection: keep-alive\r\n
    Accept: */*\r\n
    User-Agent: Mac_OS_X/10.9 (13A603) com.apple.preferences.internetaccounts.remoteservice/12.0-Calendar\r\n
    Accept-Language: en-us\r\n
    [truncated] Authorization: Digest username="tom", realm="mav.willow.vmw", nonce="d0fb5a667551b0eb63d739db", uri="/principals/__uids__/A211480B-0708-4022-A2BC-90D8B3506DFC/", response="fb5dac34abc0eae1e6c486f71aac6e2e", opaque="5beef27a775f
    Accept-Encoding: gzip, deflate\r\n
    \r\n
    [Full request URI: http://mav.willow.vmw:8443/principals/__uids__/A211480B-0708-4022-A2BC-90D8B3506DFC/]
    [HTTP request 1/1]
    [Response in frame: 200]

No.     Time           Source                Destination           Protocol Length Info
    196 45.377687000   172.16.45.1           172.16.45.176         HTTP/XML 279    PROPFIND / HTTP/1.1 

Frame 196: 279 bytes on wire (2232 bits), 279 bytes captured (2232 bits) on interface 0
Ethernet II, Src: Vmware_c0:00:08 (00:50:56:c0:00:08), Dst: Vmware_26:c6:dc (00:0c:29:26:c6:dc)
Internet Protocol Version 4, Src: 172.16.45.1 (172.16.45.1), Dst: 172.16.45.176 (172.16.45.176)
Transmission Control Protocol, Src Port: 58302 (58302), Dst Port: pcsync-https (8443), Seq: 1236, Ack: 944, Len: 213
Secure Sockets Layer
[3 Reassembled SSL segments (791 bytes): #194(610), #195(1), #196(180)]
Hypertext Transfer Protocol
    PROPFIND / HTTP/1.1\r\n
        [Expert Info (Chat/Sequence): PROPFIND / HTTP/1.1\r\n]
        Request Method: PROPFIND
        Request URI: /
        Request Version: HTTP/1.1
    Host: mav.willow.vmw:8443\r\n
    Accept: */*\r\n
    Brief: t\r\n
    [truncated] Authorization: Digest username="tom", realm="mav.willow.vmw", nonce="d0fb5a667551b0eb63d739db", uri="/", response="1306cd1f9b4859ae3dc92c7dbbd57f70", opaque="5beef27a775f326f454274eee58bf571-ZDBmYjVhNjY3NTUxYjBlYjYzZDczOWRiLDE3
    Accept-Language: en-us\r\n
    Accept-Encoding: gzip, deflate\r\n
    Content-Type: text/xml\r\n
    Content-Length: 181\r\n
    Depth: 0\r\n
    Connection: keep-alive\r\n
    User-Agent: Mac_OS_X/10.9 (13A603) com.apple.preferences.internetaccounts.remoteservice/12.0-Calendar\r\n
    Prefer: return-minimal\r\n
    \r\n
    [Full request URI: http://mav.willow.vmw:8443/]
    [HTTP request 1/1]
    [Response in frame: 208]
eXtensible Markup Language
    <?xml
        version="1.0"
        encoding="UTF-8"
        ?>
    <A:propfind
        xmlns:A="DAV:">
        <A:prop>
            <A:current-user-principal/>
            <A:principal-URL/>
            <A:resourcetype/>
            </A:prop>
        </A:propfind>

No.     Time           Source                Destination           Protocol Length Info
    200 45.384252000   172.16.45.176         172.16.45.1           SSLv3    961    HTTP/1.1 200 OK , Alert (Level: Warning, Description: Close Notify)

Frame 200: 961 bytes on wire (7688 bits), 961 bytes captured (7688 bits) on interface 0
Ethernet II, Src: Vmware_26:c6:dc (00:0c:29:26:c6:dc), Dst: Vmware_c0:00:08 (00:50:56:c0:00:08)
Internet Protocol Version 4, Src: 172.16.45.176 (172.16.45.176), Dst: 172.16.45.1 (172.16.45.1)
Transmission Control Protocol, Src Port: pcsync-https (8443), Dst Port: 58303 (58303), Seq: 162, Ack: 982, Len: 895
Secure Sockets Layer
Hypertext Transfer Protocol
    HTTP/1.1 200 OK\r\n
        [Expert Info (Chat/Sequence): HTTP/1.1 200 OK\r\n]
        Request Version: HTTP/1.1
        Status Code: 200
        Response Phrase: OK
    Content-Length: 0\r\n
    Strict-Transport-Security: max-age=604800\r\n
    Server: Twisted/12.2.0 TwistedWeb/9.0.0\r\n
    [truncated] DAV: 1, access-control, calendar-access, calendar-schedule, calendar-auto-schedule, calendar-availability, inbox-availability, calendar-proxy, calendarserver-private-events, calendarserver-private-comments, calendarserver-shari
    Allow: ACL, COPY, DELETE, GET, HEAD, LOCK, MKCOL, MOVE, OPTIONS, PROPFIND, PROPPATCH, PUT, REPORT, UNLOCK\r\n
    Date: Thu, 21 Nov 2013 12:28:10 GMT\r\n
    Connection: close\r\n
    \r\n
    [HTTP response 1/1]
    [Time since request: 0.009275000 seconds]
    [Request in frame: 188]

No.     Time           Source                Destination           Protocol Length Info
    208 45.392350000   172.16.45.176         172.16.45.1           SSLv3    177    HTTP/1.1 207 Multi-Status , Alert (Level: Warning, Description: Close Notify)

Frame 208: 177 bytes on wire (1416 bits), 177 bytes captured (1416 bits) on interface 0
Ethernet II, Src: Vmware_26:c6:dc (00:0c:29:26:c6:dc), Dst: Vmware_c0:00:08 (00:50:56:c0:00:08)
Internet Protocol Version 4, Src: 172.16.45.176 (172.16.45.176), Dst: 172.16.45.1 (172.16.45.1)
Transmission Control Protocol, Src Port: pcsync-https (8443), Dst Port: 58302 (58302), Seq: 2392, Ack: 1449, Len: 111
Secure Sockets Layer
[5 Reassembled SSL segments (1147 bytes): #207(862), #207(15), #207(252), #207(13), #208(5)]
Hypertext Transfer Protocol
    HTTP/1.1 207 Multi-Status\r\n
        [Expert Info (Chat/Sequence): HTTP/1.1 207 Multi-Status\r\n]
        Request Version: HTTP/1.1
        Status Code: 207
        Response Phrase: Multi-Status
    [truncated] DAV: 1, access-control, calendar-access, calendar-schedule, calendar-auto-schedule, calendar-availability, inbox-availability, calendar-proxy, calendarserver-private-events, calendarserver-private-comments, calendarserver-shari
    Date: Thu, 21 Nov 2013 12:28:10 GMT\r\n
    Last-Modified: Wed, 20 Nov 2013 16:41:22 GMT\r\n
    Server: Twisted/12.2.0 TwistedWeb/9.0.0\r\n
    Content-Type: text/xml\r\n
    Accept-Ranges: bytes\r\n
    Strict-Transport-Security: max-age=604800\r\n
    ETag: "806A0-66-528CE632"\r\n
    Content-Encoding: gzip\r\n
    Vary: accept-encoding\r\n
    Transfer-Encoding: chunked\r\n
    Connection: close\r\n
    \r\n
    [HTTP response 1/1]
    [Time since request: 0.014663000 seconds]
    [Request in frame: 196]
    HTTP chunked response
    Content-encoded entity body (gzip): 264 bytes -> 458 bytes
eXtensible Markup Language
    <?xml
        version='1.0'
        encoding='UTF-8'
        ?>
    <multistatus
        xmlns='DAV:'>
        <response>
            <href>
                /
                </href>
            <propstat>
                <prop>
                    <current-user-principal>
                        <href>
                            /principals/__uids__/A211480B-0708-4022-A2BC-90D8B3506DFC/
                            </href>
                        </current-user-principal>
                    <resourcetype>
                        <collection/>
                        </resourcetype>
                    </prop>
                <status>
                    HTTP/1.1 200 OK
                    </status>
                </propstat>
            </response>
        </multistatus>

No.     Time           Source                Destination           Protocol Length Info
    265 45.687713000   172.16.45.1           172.16.45.176         HTTP/XML 839    PROPFIND /principals/__uids__/A211480B-0708-4022-A2BC-90D8B3506DFC/ HTTP/1.1 

Frame 265: 839 bytes on wire (6712 bits), 839 bytes captured (6712 bits) on interface 0
Ethernet II, Src: Vmware_c0:00:08 (00:50:56:c0:00:08), Dst: Vmware_26:c6:dc (00:0c:29:26:c6:dc)
Internet Protocol Version 4, Src: 172.16.45.1 (172.16.45.1), Dst: 172.16.45.176 (172.16.45.176)
Transmission Control Protocol, Src Port: 58306 (58306), Dst Port: pcsync-https (8443), Seq: 964, Ack: 944, Len: 773
Secure Sockets Layer
[3 Reassembled SSL segments (1086 bytes): #263(343), #264(1), #265(742)]
Hypertext Transfer Protocol
    PROPFIND /principals/__uids__/A211480B-0708-4022-A2BC-90D8B3506DFC/ HTTP/1.1\r\n
        [Expert Info (Chat/Sequence): PROPFIND /principals/__uids__/A211480B-0708-4022-A2BC-90D8B3506DFC/ HTTP/1.1\r\n]
        Request Method: PROPFIND
        Request URI: /principals/__uids__/A211480B-0708-4022-A2BC-90D8B3506DFC/
        Request Version: HTTP/1.1
    Host: mav.willow.vmw:8443\r\n
    Content-Type: text/xml\r\n
    Depth: 0\r\n
    Brief: t\r\n
    Accept: */*\r\n
    Connection: keep-alive\r\n
    Prefer: return-minimal\r\n
    User-Agent: Mac_OS_X/10.9 (13A603) CalendarAgent/174\r\n
    Content-Length: 743\r\n
    Accept-Language: en-us\r\n
    Accept-Encoding: gzip, deflate\r\n
    \r\n
    [Full request URI: http://mav.willow.vmw:8443/principals/__uids__/A211480B-0708-4022-A2BC-90D8B3506DFC/]
    [HTTP request 1/1]
    [Response in frame: 269]
eXtensible Markup Language
    <?xml
        version="1.0"
        encoding="UTF-8"
        ?>
    <A:propfind
        xmlns:A="DAV:">
        <A:prop>
            <B:calendar-home-set
                xmlns:B="urn:ietf:params:xml:ns:caldav"/>
            <B:calendar-user-address-set
                xmlns:B="urn:ietf:params:xml:ns:caldav"/>
            <A:current-user-principal/>
            <A:displayname/>
            <C:dropbox-home-URL
                xmlns:C="http://calendarserver.org/ns/"/>
            <C:email-address-set
                xmlns:C="http://calendarserver.org/ns/"/>
            <C:notification-URL
                xmlns:C="http://calendarserver.org/ns/"/>
            <A:principal-collection-set/>
            <A:principal-URL/>
            <A:resource-id/>
            <B:schedule-inbox-URL
                xmlns:B="urn:ietf:params:xml:ns:caldav"/>
            <B:schedule-outbox-URL
                xmlns:B="urn:ietf:params:xml:ns:caldav"/>
            <A:supported-report-set/>
            </A:prop>
        </A:propfind>

No.     Time           Source                Destination           Protocol Length Info
    269 45.701585000   172.16.45.176         172.16.45.1           HTTP     1334   HTTP/1.1 401 Unauthorized  (text/html)

Frame 269: 1334 bytes on wire (10672 bits), 1334 bytes captured (10672 bits) on interface 0
Ethernet II, Src: Vmware_26:c6:dc (00:0c:29:26:c6:dc), Dst: Vmware_c0:00:08 (00:50:56:c0:00:08)
Internet Protocol Version 4, Src: 172.16.45.176 (172.16.45.176), Dst: 172.16.45.1 (172.16.45.1)
Transmission Control Protocol, Src Port: pcsync-https (8443), Dst Port: 58306 (58306), Seq: 944, Ack: 1737, Len: 1268
Secure Sockets Layer
[2 Reassembled SSL segments (1125 bytes): #269(984), #269(141)]
Hypertext Transfer Protocol
    HTTP/1.1 401 Unauthorized\r\n
        [Expert Info (Chat/Sequence): HTTP/1.1 401 Unauthorized\r\n]
        Request Version: HTTP/1.1
        Status Code: 401
        Response Phrase: Unauthorized
    Content-Length: 141\r\n
    Strict-Transport-Security: max-age=604800\r\n
    Server: Twisted/12.2.0 TwistedWeb/9.0.0\r\n
    [truncated] DAV: 1, access-control, calendar-access, calendar-schedule, calendar-auto-schedule, calendar-availability, inbox-availability, calendar-proxy, calendarserver-private-events, calendarserver-private-comments, calendarserver-shari
    Date: Thu, 21 Nov 2013 12:28:10 GMT\r\n
    Content-Type: text/html;charset=utf-8\r\n
    WWW-Authenticate: digest nonce="d3593a86d5cdd810840d1c57", algorithm="md5", opaque="d98af365c86e0c162f657246907cc446-ZDM1OTNhODZkNWNkZDgxMDg0MGQxYzU3LDE3Mi4xNi40NS4xLDEzODUwMzY4OTA=", realm="mav.willow.vmw"\r\n
    WWW-Authenticate: basic realm="mav.willow.vmw"\r\n
    Connection: close\r\n
    \r\n
    [HTTP response 1/1]
    [Time since request: 0.013872000 seconds]
    [Request in frame: 265]
Line-based text data: text/html
    <html><head><title>Unauthorized</title></head><body><h1>Unauthorized</h1><p>You are not authorized to access this resource.</p></body></html>

No.     Time           Source                Destination           Protocol Length Info
    294 45.712546000   172.16.45.1           172.16.45.176         HTTP/XML 839    PROPFIND /principals/__uids__/A211480B-0708-4022-A2BC-90D8B3506DFC/ HTTP/1.1 

Frame 294: 839 bytes on wire (6712 bits), 839 bytes captured (6712 bits) on interface 0
Ethernet II, Src: Vmware_c0:00:08 (00:50:56:c0:00:08), Dst: Vmware_26:c6:dc (00:0c:29:26:c6:dc)
Internet Protocol Version 4, Src: 172.16.45.1 (172.16.45.1), Dst: 172.16.45.176 (172.16.45.176)
Transmission Control Protocol, Src Port: 58307 (58307), Dst Port: pcsync-https (8443), Seq: 1035, Ack: 162, Len: 773
Secure Sockets Layer
[3 Reassembled SSL segments (1418 bytes): #292(675), #293(1), #294(742)]
Hypertext Transfer Protocol
    PROPFIND /principals/__uids__/A211480B-0708-4022-A2BC-90D8B3506DFC/ HTTP/1.1\r\n
        [Expert Info (Chat/Sequence): PROPFIND /principals/__uids__/A211480B-0708-4022-A2BC-90D8B3506DFC/ HTTP/1.1\r\n]
        Request Method: PROPFIND
        Request URI: /principals/__uids__/A211480B-0708-4022-A2BC-90D8B3506DFC/
        Request Version: HTTP/1.1
    Host: mav.willow.vmw:8443\r\n
    Accept: */*\r\n
    Brief: t\r\n
    [truncated] Authorization: Digest username="tom", realm="mav.willow.vmw", nonce="d3593a86d5cdd810840d1c57", uri="/principals/__uids__/A211480B-0708-4022-A2BC-90D8B3506DFC/", response="7ceb5e001c0859df17f44c4b0fd5ce0e", opaque="d98af365c86e
    Accept-Language: en-us\r\n
    Accept-Encoding: gzip, deflate\r\n
    Content-Type: text/xml\r\n
    Content-Length: 743\r\n
    Depth: 0\r\n
    Connection: keep-alive\r\n
    User-Agent: Mac_OS_X/10.9 (13A603) CalendarAgent/174\r\n
    Prefer: return-minimal\r\n
    \r\n
    [Full request URI: http://mav.willow.vmw:8443/principals/__uids__/A211480B-0708-4022-A2BC-90D8B3506DFC/]
    [HTTP request 1/1]
    [Response in frame: 301]
eXtensible Markup Language
    <?xml
        version="1.0"
        encoding="UTF-8"
        ?>
    <A:propfind
        xmlns:A="DAV:">
        <A:prop>
            <B:calendar-home-set
                xmlns:B="urn:ietf:params:xml:ns:caldav"/>
            <B:calendar-user-address-set
                xmlns:B="urn:ietf:params:xml:ns:caldav"/>
            <A:current-user-principal/>
            <A:displayname/>
            <C:dropbox-home-URL
                xmlns:C="http://calendarserver.org/ns/"/>
            <C:email-address-set
                xmlns:C="http://calendarserver.org/ns/"/>
            <C:notification-URL
                xmlns:C="http://calendarserver.org/ns/"/>
            <A:principal-collection-set/>
            <A:principal-URL/>
            <A:resource-id/>
            <B:schedule-inbox-URL
                xmlns:B="urn:ietf:params:xml:ns:caldav"/>
            <B:schedule-outbox-URL
                xmlns:B="urn:ietf:params:xml:ns:caldav"/>
            <A:supported-report-set/>
            </A:prop>
        </A:propfind>

No.     Time           Source                Destination           Protocol Length Info
    301 45.737238000   172.16.45.176         172.16.45.1           HTTP/XML 417    HTTP/1.1 207 Multi-Status 

Frame 301: 417 bytes on wire (3336 bits), 417 bytes captured (3336 bits) on interface 0
Ethernet II, Src: Vmware_26:c6:dc (00:0c:29:26:c6:dc), Dst: Vmware_c0:00:08 (00:50:56:c0:00:08)
Internet Protocol Version 4, Src: 172.16.45.176 (172.16.45.176), Dst: 172.16.45.1 (172.16.45.1)
Transmission Control Protocol, Src Port: pcsync-https (8443), Dst Port: 58307 (58307), Seq: 1610, Ack: 1808, Len: 351
[2 Reassembled TCP Segments (613 bytes): #300(463), #301(150)]
Secure Sockets Layer
[5 Reassembled SSL segments (1408 bytes): #300(789), #300(15), #301(586), #301(13), #301(5)]
Hypertext Transfer Protocol
    HTTP/1.1 207 Multi-Status\r\n
        [Expert Info (Chat/Sequence): HTTP/1.1 207 Multi-Status\r\n]
        Request Version: HTTP/1.1
        Status Code: 207
        Response Phrase: Multi-Status
    Content-Encoding: gzip\r\n
    Accept-Ranges: bytes\r\n
    Strict-Transport-Security: max-age=604800\r\n
    Server: Twisted/12.2.0 TwistedWeb/9.0.0\r\n
    Vary: accept-encoding\r\n
    [truncated] DAV: 1, access-control, calendar-access, calendar-schedule, calendar-auto-schedule, calendar-availability, inbox-availability, calendar-proxy, calendarserver-private-events, calendarserver-private-comments, calendarserver-shari
    Date: Thu, 21 Nov 2013 12:28:10 GMT\r\n
    Content-Type: text/xml\r\n
    Transfer-Encoding: chunked\r\n
    Connection: close\r\n
    \r\n
    [HTTP response 1/1]
    [Time since request: 0.024692000 seconds]
    [Request in frame: 294]
    HTTP chunked response
    Content-encoded entity body (gzip): 597 bytes -> 3094 bytes
eXtensible Markup Language
    <?xml
        version='1.0'
        encoding='UTF-8'
        ?>
    <multistatus
        xmlns='DAV:'>
        <response>
            <href>
                /principals/__uids__/A211480B-0708-4022-A2BC-90D8B3506DFC/
                </href>
            <propstat>
                <prop>
                    <calendar-home-set
                        xmlns='urn:ietf:params:xml:ns:caldav'>
                        <href
                            xmlns='DAV:'>
                            /calendars/__uids__/A211480B-0708-4022-A2BC-90D8B3506DFC/
                            </href>
                        </calendar-home-set>
                    <calendar-user-address-set
                        xmlns='urn:ietf:params:xml:ns:caldav'>
                        <href
                            xmlns='DAV:'>
                            /principals/__uids__/A211480B-0708-4022-A2BC-90D8B3506DFC/
                            </href>
                        <href
                            xmlns='DAV:'>
                            /principals/users/tom/
                            </href>
                        <href
                            xmlns='DAV:'>
                            urn:uuid:A211480B-0708-4022-A2BC-90D8B3506DFC
                            </href>
                        </calendar-user-address-set>
                    <current-user-principal>
                        <href>
                            /principals/__uids__/A211480B-0708-4022-A2BC-90D8B3506DFC/
                            </href>
                        </current-user-principal>
                    <displayname>
                        tom
                        </displayname>
                    <dropbox-home-URL
                        xmlns='http://calendarserver.org/ns/'>
                        <href
                            xmlns='DAV:'>
                            /calendars/__uids__/A211480B-0708-4022-A2BC-90D8B3506DFC/dropbox/
                            </href>
                        </dropbox-home-URL>
                    <email-address-set
                        xmlns='http://calendarserver.org/ns/'/>
                    <notification-URL
                        xmlns='http://calendarserver.org/ns/'>
                        <href
                            xmlns='DAV:'>
                            /calendars/__uids__/A211480B-0708-4022-A2BC-90D8B3506DFC/notification/
                            </href>
                        </notification-URL>
                    <principal-collection-set>
                        <href>
                            /principals/
                            </href>
                        </principal-collection-set>
                    <principal-URL>
                        <href>
                            /principals/__uids__/A211480B-0708-4022-A2BC-90D8B3506DFC/
                            </href>
                        </principal-URL>
                    <resource-id>
                        <href>
                            urn:uuid:A211480B-0708-4022-A2BC-90D8B3506DFC
                            </href>
                        </resource-id>
                    <schedule-inbox-URL
                        xmlns='urn:ietf:params:xml:ns:caldav'>
                        <href
                            xmlns='DAV:'>
                            /calendars/__uids__/A211480B-0708-4022-A2BC-90D8B3506DFC/inbox/
                            </href>
                        </schedule-inbox-URL>
                    <schedule-outbox-URL
                        xmlns='urn:ietf:params:xml:ns:caldav'>
                        <href
                            xmlns='DAV:'>
                            /calendars/__uids__/A211480B-0708-4022-A2BC-90D8B3506DFC/outbox/
                            </href>
                        </schedule-outbox-URL>
                    <supported-report-set>
                        <supported-report>
                            <report>
                                <acl-principal-prop-set/>
                                </report>
                            </supported-report>
                        <supported-report>
                            <report>
                                <principal-match/>
                                </report>
                            </supported-report>
                        <supported-report>
                            <report>
                                <principal-property-search/>
                                </report>
                            </supported-report>
                        <supported-report>
                            <report>
                                <expand-property/>
                                </report>
                            </supported-report>
                        <supported-report>
                            <report>
                                <calendarserver-principal-search
                                    xmlns='http://calendarserver.org/ns/'/>
                                </report>
                            </supported-report>
                        </supported-report-set>
                    </prop>
                <status>
                    HTTP/1.1 200 OK
                    </status>
                </propstat>
            </response>
        </multistatus>
Secure Sockets Layer
[5 Reassembled SSL segments (1408 bytes): #300(789), #300(15), #301(586), #301(13), #301(5)]
[5 Reassembled SSL segments (1408 bytes): #300(789), #300(15), #301(586), #301(13), #301(5)]
Hypertext Transfer Protocol
    HTTP/1.1 207 Multi-Status\r\n
        [Expert Info (Chat/Sequence): HTTP/1.1 207 Multi-Status\r\n]
        Request Version: HTTP/1.1
        Status Code: 207
        Response Phrase: Multi-Status
    Content-Encoding: gzip\r\n
    Accept-Ranges: bytes\r\n
    Strict-Transport-Security: max-age=604800\r\n
    Server: Twisted/12.2.0 TwistedWeb/9.0.0\r\n
    Vary: accept-encoding\r\n
    [truncated] DAV: 1, access-control, calendar-access, calendar-schedule, calendar-auto-schedule, calendar-availability, inbox-availability, calendar-proxy, calendarserver-private-events, calendarserver-private-comments, calendarserver-shari
    Date: Thu, 21 Nov 2013 12:28:10 GMT\r\n
    Content-Type: text/xml\r\n
    Transfer-Encoding: chunked\r\n
    Connection: close\r\n
    \r\n
    [HTTP response 1/1]
    [Time since request: 0.024692000 seconds]
    [Request in frame: 294]
    HTTP chunked response
    Content-encoded entity body (gzip): 597 bytes -> 3094 bytes
eXtensible Markup Language
    <?xml
        version='1.0'
        encoding='UTF-8'
        ?>
    <multistatus
        xmlns='DAV:'>
        <response>
            <href>
                /principals/__uids__/A211480B-0708-4022-A2BC-90D8B3506DFC/
                </href>
            <propstat>
                <prop>
                    <calendar-home-set
                        xmlns='urn:ietf:params:xml:ns:caldav'>
                        <href
                            xmlns='DAV:'>
                            /calendars/__uids__/A211480B-0708-4022-A2BC-90D8B3506DFC/
                            </href>
                        </calendar-home-set>
                    <calendar-user-address-set
                        xmlns='urn:ietf:params:xml:ns:caldav'>
                        <href
                            xmlns='DAV:'>
                            /principals/__uids__/A211480B-0708-4022-A2BC-90D8B3506DFC/
                            </href>
                        <href
                            xmlns='DAV:'>
                            /principals/users/tom/
                            </href>
                        <href
                            xmlns='DAV:'>
                            urn:uuid:A211480B-0708-4022-A2BC-90D8B3506DFC
                            </href>
                        </calendar-user-address-set>
                    <current-user-principal>
                        <href>
                            /principals/__uids__/A211480B-0708-4022-A2BC-90D8B3506DFC/
                            </href>
                        </current-user-principal>
                    <displayname>
                        tom
                        </displayname>
                    <dropbox-home-URL
                        xmlns='http://calendarserver.org/ns/'>
                        <href
                            xmlns='DAV:'>
                            /calendars/__uids__/A211480B-0708-4022-A2BC-90D8B3506DFC/dropbox/
                            </href>
                        </dropbox-home-URL>
                    <email-address-set
                        xmlns='http://calendarserver.org/ns/'/>
                    <notification-URL
                        xmlns='http://calendarserver.org/ns/'>
                        <href
                            xmlns='DAV:'>
                            /calendars/__uids__/A211480B-0708-4022-A2BC-90D8B3506DFC/notification/
                            </href>
                        </notification-URL>
                    <principal-collection-set>
                        <href>
                            /principals/
                            </href>
                        </principal-collection-set>
                    <principal-URL>
                        <href>
                            /principals/__uids__/A211480B-0708-4022-A2BC-90D8B3506DFC/
                            </href>
                        </principal-URL>
                    <resource-id>
                        <href>
                            urn:uuid:A211480B-0708-4022-A2BC-90D8B3506DFC
                            </href>
                        </resource-id>
                    <schedule-inbox-URL
                        xmlns='urn:ietf:params:xml:ns:caldav'>
                        <href
                            xmlns='DAV:'>
                            /calendars/__uids__/A211480B-0708-4022-A2BC-90D8B3506DFC/inbox/
                            </href>
                        </schedule-inbox-URL>
                    <schedule-outbox-URL
                        xmlns='urn:ietf:params:xml:ns:caldav'>
                        <href
                            xmlns='DAV:'>
                            /calendars/__uids__/A211480B-0708-4022-A2BC-90D8B3506DFC/outbox/
                            </href>
                        </schedule-outbox-URL>
                    <supported-report-set>
                        <supported-report>
                            <report>
                                <acl-principal-prop-set/>
                                </report>
                            </supported-report>
                        <supported-report>
                            <report>
                                <principal-match/>
                                </report>
                            </supported-report>
                        <supported-report>
                            <report>
                                <principal-property-search/>
                                </report>
                            </supported-report>
                        <supported-report>
